{
  "format": "tw.egress-result/0.1",
  "work_order_id": "e4-wb-chl-sp-pop-totl-2021",
  "work_order_digest": "sha256:2f78d247520a39fdb2b552f525d786ae8f3131667ad4bd76e4ffde81ae471e68",
  "origin_id": "api-worldbank-org",
  "purpose": "observation",
  "request_url": "https://api.worldbank.org/v2/country/CHL/indicator/SP.POP.TOTL?date=2021\u0026format=json\u0026per_page=1",
  "final_url": "https://api.worldbank.org/v2/country/CHL/indicator/SP.POP.TOTL?date=2021\u0026format=json\u0026per_page=1",
  "retrieved_at": "2026-08-12T03:06:22.731143871Z",
  "http_status": 400,
  "media_type": "text/html",
  "redirect_count": 0,
  "observation_digest": "sha256:5e31e524941a26235c6ccab476ef100abd99cd05787f4350268531dc528f6ddc",
  "body_digest": "sha256:0d41cf6a8bf98174b592374f2acd981947f42847cc2e50b3774822ea84a5cada",
  "body_size": 1647,
  "duration_ms": 1602
}
