{
  "format": "tw.egress-result/0.1",
  "work_order_id": "e4-wb-vnm-ny-gdp-mktp-cd-2023",
  "work_order_digest": "sha256:d9dd9191194e9572de148d540cf908a21bb39e2a6bcd1a5a98696852e84df4ca",
  "origin_id": "api-worldbank-org",
  "purpose": "observation",
  "request_url": "https://api.worldbank.org/v2/country/VNM/indicator/NY.GDP.MKTP.CD?date=2023\u0026format=json\u0026per_page=1",
  "final_url": "https://api.worldbank.org/v2/country/VNM/indicator/NY.GDP.MKTP.CD?date=2023\u0026format=json\u0026per_page=1",
  "retrieved_at": "2026-08-12T03:09:46.398448725Z",
  "http_status": 200,
  "media_type": "application/json",
  "redirect_count": 0,
  "observation_digest": "sha256:9f7d218a4ba80b9ebdf0ddcfa652c33b8246e6eb06ab501fb15d54edaaa1c7b5",
  "body_digest": "sha256:02891c4e2e5c5f47590568439b1342a35ff10b1048d0f9715cc2a05ef70ed6f7",
  "body_size": 297,
  "duration_ms": 2050
}
