{
  "format": "tw.egress-result/0.1",
  "work_order_id": "e4-wb-vnm-ny-gdp-mktp-cd-2021",
  "work_order_digest": "sha256:44f64ee08d4dfa08d4e137cc9ef6eaf5974705a5138f9a15ddff4515460704b9",
  "origin_id": "api-worldbank-org",
  "purpose": "observation",
  "request_url": "https://api.worldbank.org/v2/country/VNM/indicator/NY.GDP.MKTP.CD?date=2021\u0026format=json\u0026per_page=1",
  "final_url": "https://api.worldbank.org/v2/country/VNM/indicator/NY.GDP.MKTP.CD?date=2021\u0026format=json\u0026per_page=1",
  "retrieved_at": "2026-08-12T03:09:32.050646095Z",
  "http_status": 200,
  "media_type": "application/json",
  "redirect_count": 0,
  "observation_digest": "sha256:505db99cdd3918aa5b8b994f80acec19531a5edfca6fc94558e22424b08a6cdd",
  "body_digest": "sha256:fc3777a10a28fe2026a30858268f3d33797849b388d412842412e70fa7b15806",
  "body_size": 297,
  "duration_ms": 2643
}
