{
  "format": "tw.egress-result/0.1",
  "work_order_id": "e4-wb-usa-sp-pop-totl-2021",
  "work_order_digest": "sha256:474f855a94e3384f071fc2ec56d8cc3092a76315cb4757808bb1ea1fda4a58ba",
  "origin_id": "api-worldbank-org",
  "purpose": "observation",
  "request_url": "https://api.worldbank.org/v2/country/USA/indicator/SP.POP.TOTL?date=2021\u0026format=json\u0026per_page=1",
  "final_url": "https://api.worldbank.org/v2/country/USA/indicator/SP.POP.TOTL?date=2021\u0026format=json\u0026per_page=1",
  "retrieved_at": "2026-08-12T03:08:48.481059804Z",
  "http_status": 200,
  "media_type": "application/json",
  "redirect_count": 0,
  "observation_digest": "sha256:65897329917cf75d3904e1b13d40910242b4764c9767290a6be8d8013a96dbfa",
  "body_digest": "sha256:74cce1b2d710c55f02811bcb4a0fdf2068eb39866f5c45a19c6c885e62d95832",
  "body_size": 292,
  "duration_ms": 1429
}
