{
  "format": "tw.egress-result/0.1",
  "work_order_id": "e4-wb-usa-sp-pop-totl-2025",
  "work_order_digest": "sha256:df40dc0b3c56e3a1f41febe1bd8e74cb5d0b410695b10de8245fd5b91bd70e14",
  "origin_id": "api-worldbank-org",
  "purpose": "observation",
  "request_url": "https://api.worldbank.org/v2/country/USA/indicator/SP.POP.TOTL?date=2025\u0026format=json\u0026per_page=1",
  "final_url": "https://api.worldbank.org/v2/country/USA/indicator/SP.POP.TOTL?date=2025\u0026format=json\u0026per_page=1",
  "retrieved_at": "2026-08-12T03:09:17.156586816Z",
  "http_status": 200,
  "media_type": "application/json",
  "redirect_count": 0,
  "observation_digest": "sha256:93a2ccad48b7d9b75c7b3442014e07003fdcf05178fd480830974e70a250119e",
  "body_digest": "sha256:24eae3b423ccc9775c1b6388ecf4d6b2eaae67e5d562f7c6aae70b7127df47b2",
  "body_size": 292,
  "duration_ms": 2487
}
