{
  "format": "tw.egress-result/0.1",
  "work_order_id": "e4-wb-chl-sp-pop-totl-2020",
  "work_order_digest": "sha256:56d1af6e0f3acc0de8fc76505421016364f83fff3c78980107cc875a42fb4a54",
  "origin_id": "api-worldbank-org",
  "purpose": "observation",
  "request_url": "https://api.worldbank.org/v2/country/CHL/indicator/SP.POP.TOTL?date=2020\u0026format=json\u0026per_page=1",
  "final_url": "https://api.worldbank.org/v2/country/CHL/indicator/SP.POP.TOTL?date=2020\u0026format=json\u0026per_page=1",
  "retrieved_at": "2026-08-12T03:06:16.093634281Z",
  "http_status": 200,
  "media_type": "application/json",
  "redirect_count": 0,
  "observation_digest": "sha256:20ad74bd5ce2b6e76c712688da7b7c7924b0b28d7dabe06caf1f1168a637e8c7",
  "body_digest": "sha256:c12c156781fe6dee20c690462a386b5528b8db31427c5a671604a4631d7ef94f",
  "body_size": 283,
  "duration_ms": 1988
}
