{
  "format": "tw.egress-result/0.1",
  "work_order_id": "futo-rfc-editor-robots",
  "work_order_digest": "sha256:b01d2f74c425021e201b5bc891477c002b5bfb21e0c67d0f5a49636727bf19a1",
  "origin_id": "rfc-editor-org",
  "purpose": "robots",
  "request_url": "https://www.rfc-editor.org/robots.txt",
  "final_url": "https://www.rfc-editor.org/robots.txt",
  "retrieved_at": "2026-08-11T12:20:06.617760004Z",
  "http_status": 200,
  "media_type": "text/plain",
  "redirect_count": 0,
  "observation_digest": "sha256:151cf0b9cebe42bf87d2489a855e32bbe6dd6b795f6844e30c48cb8891520b44",
  "body_digest": "sha256:df052cf390448ea2916ce4d3b5f6e42880cd246ea2bf1d5efce5596b1b2e3827",
  "body_size": 135,
  "duration_ms": 2519
}
