{
  "format": "tw.egress-result/0.1",
  "work_order_id": "e4-wb-usa-sp-pop-totl-2023",
  "work_order_digest": "sha256:401ceb8e0453754eb96aed1a6ad9bee916b98962957809fb831805220eb94832",
  "origin_id": "api-worldbank-org",
  "purpose": "observation",
  "request_url": "https://api.worldbank.org/v2/country/USA/indicator/SP.POP.TOTL?date=2023\u0026format=json\u0026per_page=1",
  "final_url": "https://api.worldbank.org/v2/country/USA/indicator/SP.POP.TOTL?date=2023\u0026format=json\u0026per_page=1",
  "retrieved_at": "2026-08-12T03:09:03.171776958Z",
  "http_status": 200,
  "media_type": "application/json",
  "redirect_count": 0,
  "observation_digest": "sha256:64a24e8240ce6d414e924e14367837bd7d029a5d2432f3336b974a113cbd1bc6",
  "body_digest": "sha256:ead9dffb8c233d6da954e28056e5fe7614adbcc255605eb2f0945ab4d67d28bb",
  "body_size": 292,
  "duration_ms": 2313
}
