{
  "format": "tw.egress-result/0.1",
  "work_order_id": "e4-wb-usa-ny-gdp-mktp-cd-2022",
  "work_order_digest": "sha256:e8b984ff479cf46c7d2be355bdd078171a7cb96857f08ad36d3772badf4ae817",
  "origin_id": "api-worldbank-org",
  "purpose": "observation",
  "request_url": "https://api.worldbank.org/v2/country/USA/indicator/NY.GDP.MKTP.CD?date=2022\u0026format=json\u0026per_page=1",
  "final_url": "https://api.worldbank.org/v2/country/USA/indicator/NY.GDP.MKTP.CD?date=2022\u0026format=json\u0026per_page=1",
  "retrieved_at": "2026-08-12T03:08:12.767561564Z",
  "http_status": 200,
  "media_type": "application/json",
  "redirect_count": 0,
  "observation_digest": "sha256:fac296b1f268a5b767ff824892b46bfbcbadf751339673951c3e3f1e89b660af",
  "body_digest": "sha256:d8bc789bac4d4cf304a0c39330ce74bde301f6a2a07160ba762524443c9be637",
  "body_size": 300,
  "duration_ms": 1485
}
