{
  "format": "tw.egress-result/0.1",
  "work_order_id": "e4-wb-vnm-sp-pop-totl-2024",
  "work_order_digest": "sha256:6f80800b32530bf23b78faa9b9089620176994b8c7769970f1427e55b9a9cc3a",
  "origin_id": "api-worldbank-org",
  "purpose": "observation",
  "request_url": "https://api.worldbank.org/v2/country/VNM/indicator/SP.POP.TOTL?date=2024\u0026format=json\u0026per_page=1",
  "final_url": "https://api.worldbank.org/v2/country/VNM/indicator/SP.POP.TOTL?date=2024\u0026format=json\u0026per_page=1",
  "retrieved_at": "2026-08-12T03:10:38.141836546Z",
  "http_status": 200,
  "media_type": "application/json",
  "redirect_count": 0,
  "observation_digest": "sha256:9d45173c3e53ff15d1dfa49f82ab9d823418d4aee251dee517f32be25b8b9253",
  "body_digest": "sha256:d33ecbcc6ff7fc8e028d79bb3b40549ec64aed7c24b14a5db8faf6bc9a66f4a5",
  "body_size": 287,
  "duration_ms": 2290
}
