{
  "format": "tw.egress-result/0.1",
  "work_order_id": "e4-wb-chl-sp-pop-totl-2023",
  "work_order_digest": "sha256:33fbf6ef51165acebb35e4d3f548e791049c410bb94a7918599dd131395d3af0",
  "origin_id": "api-worldbank-org",
  "purpose": "observation",
  "request_url": "https://api.worldbank.org/v2/country/CHL/indicator/SP.POP.TOTL?date=2023\u0026format=json\u0026per_page=1",
  "final_url": "https://api.worldbank.org/v2/country/CHL/indicator/SP.POP.TOTL?date=2023\u0026format=json\u0026per_page=1",
  "retrieved_at": "2026-08-12T03:07:37.018464258Z",
  "http_status": 200,
  "media_type": "application/json",
  "redirect_count": 0,
  "observation_digest": "sha256:6247561569451daa35ef147aad084cecda44a6638dc18f8ab4f5691094bd750e",
  "body_digest": "sha256:447f2374eb6b0dc9fa9200ed3c6e0b23fbf30903b679269ff5d41513185ba838",
  "body_size": 283,
  "duration_ms": 2138
}
