{
  "format": "tw.egress-result/0.1",
  "work_order_id": "e4-wb-chl-ny-gdp-mktp-cd-2022",
  "work_order_digest": "sha256:477f3c74145f7ead3f055b493bca91968f87d8493a9422c1a47f925e0ff5ffd2",
  "origin_id": "api-worldbank-org",
  "purpose": "observation",
  "request_url": "https://api.worldbank.org/v2/country/CHL/indicator/NY.GDP.MKTP.CD?date=2022\u0026format=json\u0026per_page=1",
  "final_url": "https://api.worldbank.org/v2/country/CHL/indicator/NY.GDP.MKTP.CD?date=2022\u0026format=json\u0026per_page=1",
  "retrieved_at": "2026-08-12T03:05:49.348827127Z",
  "http_status": 200,
  "media_type": "application/json",
  "redirect_count": 0,
  "observation_digest": "sha256:29b354d67b7dd99d717887c099c38daff348306a4fa1c877b1dbc427be53376e",
  "body_digest": "sha256:fd296487fea12c5edcca677efee253dd8b358531db074aa4ab77b1be26aeae90",
  "body_size": 294,
  "duration_ms": 2348
}
