{
  "format": "tw.egress-result/0.1",
  "work_order_id": "e4-wb-chl-sp-pop-totl-2022",
  "work_order_digest": "sha256:a66ebfe49ca31be1e18834025f999dc02971195698601abce494595b7427e993",
  "origin_id": "api-worldbank-org",
  "purpose": "observation",
  "request_url": "https://api.worldbank.org/v2/country/CHL/indicator/SP.POP.TOTL?date=2022\u0026format=json\u0026per_page=1",
  "final_url": "https://api.worldbank.org/v2/country/CHL/indicator/SP.POP.TOTL?date=2022\u0026format=json\u0026per_page=1",
  "retrieved_at": "2026-08-12T03:07:29.836166941Z",
  "http_status": 200,
  "media_type": "application/json",
  "redirect_count": 0,
  "observation_digest": "sha256:68fa9e8c51102226b180680bf974013ad9f991372b0b0b9a516c66afe1b178c9",
  "body_digest": "sha256:2911a12012e4dab13dfcb613eb81e59c73c0c7f405f0409bae1ecbe1859d0d0c",
  "body_size": 283,
  "duration_ms": 2612
}
