{
  "format": "tw.egress-result/0.1",
  "work_order_id": "e4-wb-usa-ny-gdp-mktp-cd-2021",
  "work_order_digest": "sha256:db21982f4c51968cabae2c7c3a8b2b8dce0129795fe7230aa1d100065d607083",
  "origin_id": "api-worldbank-org",
  "purpose": "observation",
  "request_url": "https://api.worldbank.org/v2/country/USA/indicator/NY.GDP.MKTP.CD?date=2021\u0026format=json\u0026per_page=1",
  "final_url": "https://api.worldbank.org/v2/country/USA/indicator/NY.GDP.MKTP.CD?date=2021\u0026format=json\u0026per_page=1",
  "retrieved_at": "2026-08-12T03:08:06.256385936Z",
  "http_status": 200,
  "media_type": "application/json",
  "redirect_count": 0,
  "observation_digest": "sha256:fd97fdfc071ccdcfc26c22fdc31ac150a23007decded9d28009da04f448c6c36",
  "body_digest": "sha256:65828b4403b2e040de6808b5feb74b3484971d82c458321439b0958e04ff037f",
  "body_size": 300,
  "duration_ms": 2483
}
