{
  "format": "tw.egress-result/0.1",
  "work_order_id": "e4-wb-vnm-ny-gdp-mktp-cd-2024",
  "work_order_digest": "sha256:0ff16660851dd6f8d8414795e22476051eff39ba06dbdac2914db992b4b889f4",
  "origin_id": "api-worldbank-org",
  "purpose": "observation",
  "request_url": "https://api.worldbank.org/v2/country/VNM/indicator/NY.GDP.MKTP.CD?date=2024\u0026format=json\u0026per_page=1",
  "final_url": "https://api.worldbank.org/v2/country/VNM/indicator/NY.GDP.MKTP.CD?date=2024\u0026format=json\u0026per_page=1",
  "retrieved_at": "2026-08-12T03:09:53.750574488Z",
  "http_status": 200,
  "media_type": "application/json",
  "redirect_count": 0,
  "observation_digest": "sha256:4c7a4163fdd4829107957c4c8d70b7f917bb8b77a8341d6ae353748fff2b2747",
  "body_digest": "sha256:37801b5d6fe470e2060d2d032741469b60a0755f78e062aafe6f1b4bf7df4305",
  "body_size": 297,
  "duration_ms": 2394
}
