{
  "format": "tw.egress-result/0.1",
  "work_order_id": "e4-wb-usa-ny-gdp-mktp-cd-2024",
  "work_order_digest": "sha256:8c1d42277de3f1675adf61ab27e634344a9544f4c664e297cc953101d3823bf9",
  "origin_id": "api-worldbank-org",
  "purpose": "observation",
  "request_url": "https://api.worldbank.org/v2/country/USA/indicator/NY.GDP.MKTP.CD?date=2024\u0026format=json\u0026per_page=1",
  "final_url": "https://api.worldbank.org/v2/country/USA/indicator/NY.GDP.MKTP.CD?date=2024\u0026format=json\u0026per_page=1",
  "retrieved_at": "2026-08-12T03:08:27.567303055Z",
  "http_status": 200,
  "media_type": "application/json",
  "redirect_count": 0,
  "observation_digest": "sha256:15d8de19f444729377893757f93d943a4820ba21de886613ecfc48dab9b4facb",
  "body_digest": "sha256:b6bd197049d79f25562a6c33b8b270f44d86dcc90600e34d2e4309cc94d37161",
  "body_size": 300,
  "duration_ms": 2313
}
