{
  "format": "tw.egress-result/0.1",
  "work_order_id": "e4-wb-usa-ny-gdp-mktp-cd-2023",
  "work_order_digest": "sha256:00e846ef441c873578788a4341ba004acdf3720614bb619e3a03d7e5e17dacc3",
  "origin_id": "api-worldbank-org",
  "purpose": "observation",
  "request_url": "https://api.worldbank.org/v2/country/USA/indicator/NY.GDP.MKTP.CD?date=2023\u0026format=json\u0026per_page=1",
  "final_url": "https://api.worldbank.org/v2/country/USA/indicator/NY.GDP.MKTP.CD?date=2023\u0026format=json\u0026per_page=1",
  "retrieved_at": "2026-08-12T03:08:20.230683992Z",
  "http_status": 200,
  "media_type": "application/json",
  "redirect_count": 0,
  "observation_digest": "sha256:6e53f2c6fabf98bc158513cc6ac9f1a2683033754f85034c038e5580623cfc51",
  "body_digest": "sha256:035b549ec5882c7f06f1c28e2f4349f9b8e65bf032831fb8f9e2bf4f00c63be1",
  "body_size": 300,
  "duration_ms": 2366
}
